id,text,label,text_id_su,text_su_id,text_id_ja,text_ja_id,text_id_en,text_en_id,text_MS_id_en,text_MS_en_id,verdict_id,verdict_su,verdict_ja,verdict_en,verdict_MS_en
217,Roti bakar duti ini sudah ada sejak dulu di sini. Rotinya biasa saja sih. Hanya menu pilihannya buanyak banget. Apa saja ada. Sampe kadang bingung mau pilih yang isi apa. Ada jual bubur juga. Oke jugalah.,positive,Roti bakar Duti ieu tos lami aya di dieu. Roti téh biasa waé. Tapi pilihan menu seueur pisan. Aranjeunna gaduh sagalana. Kadang-kadang anjeun bingung ngeunaan ngeusian naon anu kedah dipilih. Éta ogé ngajual bubur. Teu kunanaon ogé.,Roti panggang Duti ini sudah ada sejak lama. Rotinya biasa saja. Tapi pilihan menunya banyak. Semuanya lengkap. Kadang bingung mau pilih yang isi apa. Buburnya juga dijual di sini. Lumayan juga.,Roti bakar Duti iki wis suwe ana ing kene. Roti kasebut mung biasa. Nanging pilihan menu akeh banget. Dheweke duwe kabeh. Kadhangkala sampeyan bingung babagan ngisi sing kudu dipilih. Dheweke uga adol bubur. Ora apa-apa uga.,Roti panggang Duti ini sudah ada sejak lama. Rotinya biasa saja. Tapi pilihan menunya banyak sekali. Semuanya lengkap. Kadang bingung mau pilih isi yang mana. Mereka juga jual bubur. Lumayan juga.,This Duti toast has been around for a long time here. The bread is just ordinary. But the menu choices are so many. They have everything. Sometimes you get confused about what filling to choose. They also sell porridge. That's okay too.,Roti panggang Duti ini sudah ada sejak lama di sini. Rotinya biasa saja. Tapi pilihan menunya banyak sekali. Semuanya lengkap. Kadang bingung mau pilih isi apa. Mereka juga jual bubur. Nggak apa-apa juga.,"This duti toast has been here for a long time. The bread is ordinary. Only the menu selection is really good. Anything exists. At times, you may be confused as to what to choose. There is also a porridge sale. Okay, too.","Roti panggang duti ini sudah ada di sini sejak lama. Rotinya biasa-biasa saja. Hanya pilihan menunya yang benar-benar bagus. Apa pun ada. Terkadang, Anda mungkin bingung harus memilih apa. Ada juga penjualan bubur. Oke juga.",,2,2,2,1
219,Nikmati cicilan 0% hingga 12 bulan untuk pemesanan tiket pesawat air asia dengan kartu kredit bni!,neutral,Ngarasakeun cicilan 0% nepi ka 12 bulan pikeun mesen tikét penerbangan Air Asia nganggo kartu kiridit BNI!,Nikmati cicilan 0% hingga 12 bulan untuk pemesanan tiket pesawat Air Asia dengan kartu kredit BNI!,Nikmati cicilan 0% nganti 12 wulan kanggo pesen tiket pesawat Air Asia nganggo kertu kredit BNI!,Nikmati cicilan 0% hingga 12 bulan untuk memesan penerbangan Air Asia dengan kartu kredit BNI Anda!,Enjoy 0% installments for up to 12 months for booking Air Asia flight tickets with a BNI credit card!,Nikmati cicilan 0% hingga 12 bulan untuk pemesanan tiket pesawat Air Asia dengan kartu kredit BNI!,Enjoy 0% installment for up to 12 months on Air Asia flight ticket booking with BNI credit card!,Nikmati cicilan 0% hingga 12 bulan untuk pemesanan tiket pesawat Air Asia dengan kartu kredit BNI!,,2,2,2,2
224,Sulit sekali mengerti orang yang merasa selalu benar,negative,Hésé ngarti jalma-jalma anu ngarasa dirina salawasna bener.,Sulit untuk memahami orang yang merasa dirinya selalu benar.,Pancen angel ngerteni wong sing rumangsa bener.,Sulit untuk mengenali orang yang merasa benar.,It's hard to understand people who feel they are always right.,Sulit untuk memahami orang yang merasa dirinya selalu benar.,It's hard to understand people who feel they're always right,Sulit untuk memahami orang yang merasa mereka selalu benar,,2,1,2,2
225,Rizal ramli beberkan cara stabilkan harga beras,neutral,Rizal Ramli ngajelaskeun kumaha carana nyetabilkeun harga béas,Rizal Ramli jelaskan cara stabilisasi harga beras,Rizal Ramli njlentrehake cara kanggo stabilake rega beras,Rizal Ramli jelaskan cara stabilisasi harga beras,Rizal Ramli explains how to stabilize rice prices,Rizal Ramli jelaskan cara stabilisasi harga beras,Rizal Ramli Reveals How to Stabilize Rice Prices,Rizal Ramli Ungkap Cara Menstabilkan Harga Beras,,1,1,1,1
227,"Menikmati kota bandung tanpa kuliner, kurang seru, kafe halaman, menyajikan makanan indonesia, gado gadonya enak, pisang goreng kejunya juga enak serta secangkir kopi sambil menunggu teman datang sangatlah menarik",positive,"Ngarasakeun kota Bandung tanpa nikmat kuliner teu pati seru. Kafé pakarangan nyayogikeun kadaharan Indonésia. Gado gado ngeunah pisan, cau goreng kéju ogé nikmat jeung sacangkir kopi bari nungguan babaturan datang pisan metot.","Menikmati kota Bandung tanpa kuliner memang kurang seru. The Courtyard Cafe menyajikan makanan khas Indonesia. Gado-gadonya sangat lezat, pisang goreng kejunya juga lezat, dan secangkir kopi sambil menunggu teman datang sangat menarik.","Menikmati kota Bandung tanpa jajanan kuliner ya nggak seru banget. Warung pekarangan nyediakake panganan Indonesia. Gado gado enak, gedhang goreng keju uga enak lan secangkir kopi karo ngenteni kanca-kanca teka sing menarik banget.","Menikmati kota Bandung tanpa kuliner memang kurang asyik. Restoran Courtyard menyajikan makanan khas Indonesia. Gado-gadonya enak, pisang goreng kejunya juga enak, dan secangkir kopi sambil menunggu teman datang sungguh mengasyikkan.","Enjoying the city of Bandung without culinary delights is not very exciting. The yard cafe serves Indonesian food. The gado gado is delicious, the fried banana with cheese is also delicious and a cup of coffee while waiting for friends to arrive is very interesting.","Menikmati kota Bandung tanpa kuliner memang kurang seru. The Yard Cafe menyajikan makanan khas Indonesia. Gado-gadonya enak, pisang goreng kejunya juga enak, dan secangkir kopi sambil menunggu teman datang sungguh mengasyikkan.","Enjoying the city of Bandung without culinary, less exciting, courtyard cafes, serving Indonesian food, gado gadonya is delicious, the fried banana cheese is also delicious and a cup of coffee while waiting for friends to come is very interesting","Menikmati kota Bandung tanpa kuliner, kurang seru, kafe halaman, menyajikan makanan Indonesia, gado gadonya enak, keju pisang goreng juga enak dan secangkir kopi sambil menunggu teman-teman datang sangat menarik",,1,1,1,2
228,"Saya makan pagi di restoran lantai 18 ini dan kebetulan saya mendapatkan tempat duduk di luar atau balkon. Bantalan tempat duduknya terlihat banyak noda kotoran. Angin sangat kencang bertiup sehingga makan pagi tidak nyaman. Saya sarankan apabila anda makan di restoran ini, pilih tempat duduk di dalam untuk kenyamanan.",negative,"Abdi sarapan di réstoran lantai 18 ieu sareng kuring kabeneran meunang korsi di luar atanapi balkon. Bantal korsi katingalina seueur noda kokotor. Angin ngagelebug kacida gedéna, jadi sasarap téh teu genah. Kuring nyarankeun lamun dahar di réstoran ieu, milih korsi di jero pikeun kanyamanan.","Saya sarapan di restoran lantai 18 ini dan kebetulan mendapat tempat duduk di luar atau balkon. Bantalan kursinya tampak banyak bercak kotoran. Angin bertiup sangat kencang, jadi sarapannya kurang nyaman. Saya sarankan jika Anda makan di restoran ini, pilihlah tempat duduk di dalam agar lebih nyaman.","Aku nedha isuk ing restoran lantai 18 iki lan aku entuk kursi ing njaba utawa loteng. Bantal kursi katon akeh reregetan. Angin kenceng banget, mulane sarapan ora kepenak. Aku menehi saran yen sampeyan mangan ing restoran iki, pilih kursi ing njero supaya kepenak.","Saya sarapan di restoran lantai 18 ini dan saya mendapat tempat duduk di luar atau balkon. Bantalan kursinya tampak banyak noda. Anginnya sangat kencang, jadi sarapannya tidak enak. Saya sarankan jika Anda makan di restoran ini, pilihlah tempat duduk di dalam agar lebih nyaman.","I had breakfast at this 18th floor restaurant and I happened to get a seat outside or balcony. The seat cushions looked like they had a lot of dirt stains. The wind was blowing very hard so having breakfast was uncomfortable. I suggest if you eat at this restaurant, choose a seat inside for comfort.","Saya sarapan di restoran lantai 18 ini dan kebetulan dapat tempat duduk di luar atau balkon. Bantalan kursinya terlihat banyak bercak kotoran. Angin bertiup sangat kencang sehingga sarapan terasa tidak nyaman. Saran saya kalau makan di restoran ini, pilih tempat duduk di dalam agar lebih nyaman.","I had breakfast at this 18th floor restaurant and I happened to get a seat outside or a balcony. The seat cushions look a lot of dirt stains. The wind was so strong that breakfast was uncomfortable. I recommend that when you eat at this restaurant, choose the seats inside for convenience.","Saya sarapan di restoran lantai 18 ini dan saya kebetulan mendapatkan tempat duduk di luar atau balkon. Bantalan kursi terlihat banyak noda kotoran. Angin begitu kencang sehingga sarapan tidak nyaman. Saya sarankan bahwa ketika Anda makan di restoran ini, pilih kursi di dalam untuk kenyamanan.",,2,2,2,2
229,Ini adalah tempat makan untuk orang yang menunggu keluarganya yang sedang asyik berbelanja. Tetapi tidak untuk orang orang yang senang makanan yang enak. Di jakarta banyak sekali tempat makan yang jauh lebih enak dan harganya jauh lebih murah.,negative,Ieu mangrupikeun tempat tuang pikeun jalma anu ngantosan kulawargana anu sibuk balanja. Tapi henteu pikeun jalma anu resep tuangeun anu saé. Di Jakarta seueur tempat tuang anu langkung saé sareng langkung mirah.,"Ini adalah tempat makan bagi mereka yang sedang menunggu keluarga mereka yang sedang sibuk berbelanja. Namun tidak untuk mereka yang suka makanan enak. Di Jakarta, ada banyak tempat makan yang lebih baik dan lebih murah.",Iki minangka papan kanggo mangan kanggo wong sing ngenteni kulawargane sing sibuk blanja. Nanging ora kanggo wong sing seneng panganan sing enak. Ing Jakarta akeh panggonan mangan sing luwih enak lan murah.,"Ini adalah tempat makan bagi orang-orang yang sedang menunggu keluarga mereka yang sedang sibuk berbelanja. Namun tidak bagi mereka yang suka makanan enak. Di Jakarta, ada banyak tempat makan yang lebih enak dan murah.",This is a place to eat for people who are waiting for their families who are busy shopping. But not for people who like good food. In Jakarta there are many places to eat that are much better and much cheaper.,Ini adalah tempat makan bagi orang-orang yang sedang menunggu keluarga mereka yang sedang sibuk berbelanja. Namun tidak untuk orang-orang yang suka makanan enak. Di Jakarta ada banyak tempat makan yang jauh lebih baik dan jauh lebih murah.,"This is a place to eat for people who are waiting for their families who are engrossed in shopping. But not for people who like good food. In Jakarta, there are a lot of places to eat that are much more delicious and much cheaper.","Ini adalah tempat makan bagi orang-orang yang sedang menunggu keluarganya yang asyik berbelanja. Tapi tidak untuk orang yang menyukai makanan enak. Di Jakarta, ada banyak tempat makan yang jauh lebih lezat dan jauh lebih murah.",,2,2,2,2
230,"Tenderloin steak di suis butcher sangat enak - juicy, dan saus kuisnya pas di lidah. Selain itu harganya pun pas di kantong. Oleh karena itu, bersiaplah untuk mengantre apabila anda berkunjung di akhir pekan dan pada saat jam makan pula.",positive,"Steak tenderloin di suis butcher ngeunah pisan - juicy, sareng saosna pas dina létah. Tambih Deui, hargana ogé ramah-saku. Janten siap antri upami anjeun nganjang dina sabtu minggu sareng waktos tuang ogé.","Steak tenderloin Butcher sangat lezat - juicy, dan sausnya pas di lidah. Ditambah lagi, harganya juga ramah di kantong. Jadi, bersiaplah untuk mengantre jika Anda berkunjung di akhir pekan dan juga saat jam makan.","Steak tenderloin ing suis butcher banget sedhep - jus, lan saus pas ing ilat. Kajaba iku, regane uga ramah kantong. Dadi siyap antri yen sampeyan ngunjungi ing akhir minggu lan nalika mangan uga.","Daging tenderloin steak di suis butcher sangat lezat - juicy, dan sausnya pas di lidah. Selain itu, harganya juga ramah di kantong. Jadi, bersiaplah untuk mengantre jika Anda berkunjung di akhir pekan dan juga saat jam makan.","The tenderloin steak at suis butcher is very tasty - juicy, and the sauce is just right on the tongue. Plus, the price is also pocket-friendly. So be prepared to queue if you visit on weekends and during meal times too.","Daging tenderloin steak di suis butcher sangat lezat - juicy, dan sausnya pas di lidah. Ditambah lagi, harganya juga ramah di kantong. Jadi, bersiaplah untuk mengantre jika Anda berkunjung di akhir pekan dan juga saat jam makan.","The steak tenderloin on the butcher's switch is very tasty - juicy, and the quiz sauce fits right on the tongue. In addition, the price also fits in your pocket. Therefore, be prepared to wait in line if you visit on weekends and during mealtimes.","Tenderloin steak di sakelar daging sangat enak - berair, dan saus kuisnya pas di lidah. Selain itu, harganya juga muat di saku Anda. Oleh karena itu, bersiaplah untuk mengantri jika Anda berkunjung pada akhir pekan dan saat makan.",,1,2,2,1
231,Makan di atas gunung degan pemandangan lampu kota kalau malam sangat indah. Makanannya juga enak harga standar seperti kafe yang lain.,positive,"Dahar di gunung jeung panempoan lampu kota peuting pisan geulis. Dahareunna ogé ngeunah, hargana standar kawas kafe séjén.","Makan di pegunungan dan pemandangan lampu kota di malam hari sangat indah. Makanannya juga enak, harganya standar seperti kafe lainnya.","Mangan ing gunung kanthi pemandangan lampu kutha ing wayah wengi apik banget. Panganan uga enak, regane standar kaya warung-warung liyane.","Makan di atas gunung sambil menikmati pemandangan lampu-lampu kota di malam hari sungguh nikmat. Makanannya juga enak, harganya standar seperti restoran lain.","Eating on a mountain with a view of the city lights at night is very beautiful. The food is also delicious, the price is standard like other cafes.","Makan di atas gunung dengan pemandangan lampu kota di malam hari sangat indah. Makanannya juga lezat, harganya standar seperti kafe lainnya.",Eating on the mountain with a view of the city lights at night is very beautiful. The food is also good at standard prices like other cafes.,Makan di gunung dengan pemandangan lampu kota di malam hari sangat indah. Makanannya juga enak dengan harga standar seperti kafe lainnya.,,1,2,2,2
232,Kak adit aku pesan indominya satu,neutral,"Kang Adit, abdi mesen hiji Indomie","Pak Adit, saya pesan Indomie","Bro Adit, aku pesen Indomie siji","Bro Adit, saya pesan satu Indomie","Bro Adit, I ordered one Indomie","Bro Adit, saya pesan satu Indomie","Hi Anna, I'd like to give you a hint of one","Hai Anna, saya ingin memberi Anda petunjuk tentang satu",,1,1,1,2
234,"Berubah status jadi universitas, bsi gelar seminar motivasi",neutral,"Ngarobah status ka universitas, bisa ngayakeun seminar motivasi","Ubah status jadi universitas, bisa adakan seminar motivasi","Ganti status menyang universitas, bisa nganakake seminar motivasi","Berubah status menjadi universitas, bisa mengadakan seminar motivasi","Changing status to university, can hold motivational seminars","Berubah status menjadi universitas, bisa mengadakan seminar motivasi","Changing status to university, bsi holds motivational seminar","Ganti status ke universitas, BSI gelar seminar motivasi",,1,1,1,2
236,"Rasanya lumayan. Sambelnya juga enak. Apalagi disajikan 3 macam model begitu. Terus banyak pilihan sih sebenarnya mau makan apa di sini. Mau gurame, mau kakap, bawal, kerang, cumi, udang. Macem-macem deh. Asal jangan pesan ikan kembung saja. Tidak ada di sini.",positive,"Rasana lumayan. Sambel cabe oge enak. Sumawona, dilayanan dina 3 jinis sapertos kitu. Lajeng aya sabenerna loba pilihan naon dahar di dieu. Hayang gurami, kakap, bawal, kerang, cumi, hurang. Rupa-rupa. Ngan ulah ngan mesen mackerel. Teu di dieu.","Rasanya enak. Sambalnya juga enak. Apalagi disajikan dalam 3 jenis. Lalu sebenarnya banyak pilihan makan di sini. Mau gurami, kakap, bawal, kerang, cumi, udang. Macam-macam. Jangan cuma pesan makarel. Tidak di sini.","Rasane cukup enak. Sambel cabe uga enak. Kajaba iku, ana 3 jinis kaya ngono. Banjur ana akeh pilihan kanggo mangan ing kene. Pengin gurami, kakap, bawal, kerang, cumi, udang. Macem-macem. Aja mung pesen mackerel. Ora ana kene.","Rasanya lumayan enak. Sambalnya juga enak. Selain itu, ada 3 jenis. Lalu, ada banyak pilihan makan di sini. Saya mau gurami, kakap, bawal, kerang, cumi, udang. Macam-macam. Jangan cuma pesan makarel. Tidak di sini.","The taste is quite good. The chili sauce is also delicious. Moreover, it is served in 3 types like that. Then there are actually many choices of what to eat here. Want gourami, snapper, pomfret, clams, squid, shrimp. Various. Just don't just order mackerel. It's not here.","Rasanya lumayan enak. Sambalnya juga enak. Apalagi disajikan dalam 3 jenis seperti itu. Terus pilihan makan di sini juga banyak banget. Mau gurami, kakap, bawal, kerang, cumi, udang. Macam-macam. Jangan cuma pesan makarel. Nggak ada di sini.","It tastes good. The sambel is also delicious. Moreover, it is presented with 3 kinds of models. Then there are many choices, what do you actually want to eat here. You want carp, you want snapper, you want to bacon, you want clams, you want squid, you want shrimp. Variety. As long as you don't order mackerel. Not here.","Rasanya enak. Sambelnya juga enak. Selain itu, disajikan dengan 3 jenis model. Lalu ada banyak pilihan, apa yang sebenarnya ingin kamu makan di sini. Anda ingin ikan mas, Anda ingin kakap, Anda ingin bacon, Anda ingin kerang, Anda ingin cumi-cumi, Anda ingin udang. Ragam. Selama Anda tidak memesan makarel. Tidak disitu.",,1,1,1,1
238,Jutek banget deh karyawan indosat yang di graha indosat,negative,Para karyawan Indosat di Graha Indosat mah kurang ajar,Karyawan Indosat di Graha Indosat tidak sopan,Karyawan Indosat ing Graha Indosat pancen ora sopan,Karyawan Indosat di Graha Indosat sangat kasar,Indosat employees at Graha Indosat are really rude,Karyawan Indosat di Graha Indosat sangat kasar,It's a shame that the Indo-Pacific's employees are so unhappy with the way things are going.,Sangat disayangkan bahwa karyawan Indo-Pasifik begitu tidak senang dengan keadaan yang berjalan.,,2,1,1,2
239,"Promonya menipu atau gimana ya. Dicek katanya ada promo 77 ribu dapat kuota 30 gb diskon 40% dari harga aslinya, pas saya isi pulsa sebesar 80 ribu belum di daftarkan apa-apa sudah banyak ke potong 5 ribu. Kenapa bisa begitu ya? Kecewa sih.",negative,"Naha promo éta scam atanapi naon? Pas dipariksa, cenah aya promo 77 rebu meunang kuota 30 GB diskon 40% tina harga aslina. Nalika kuring ngeusian kiridit kuring 80 rébu sareng henteu ngadaptar nanaon, éta parantos dipotong ku 5 rébu. Kumaha bisa kitu? Kuring kuciwa.",Promonya penipuan atau apa ya? Setelah dicek katanya ada promo 77 ribu untuk mendapatkan kuota 30 GB dengan potongan 40% dari harga awal. Pas saya isi pulsa 80 ribu dan belum registrasi apa-apa malah sudah dipotong 5 ribu. Kok bisa? Saya kecewa.,"Apa promo iku scam utawa apa? Dipriksa jarene ana promo 77 ewu entuk kuota 30 GB diskon 40% saka rega asline. Bareng ngisi pulsa 80 ewu ora ndhaptar apa-apa, wis dipotong 5 ewu. Kepiye carane bisa? Aku kuciwa.",Promonya penipuan atau apa ya? Sudah dicek katanya ada promo 77 ribu dapat kuota 30 GB diskon 40% dari harga awal. Waktu isi pulsa 80 ribu tanpa registrasi apa pun malah kepotong 5 ribu. Kok bisa? Saya kecewa.,"Is the promo a scam or what? When I checked, it said there was a promo for 77 thousand and get a 30 GB quota with a 40% discount from the original price. When I filled in my credit for 80 thousand and didn't register anything, it was already cut by 5 thousand. How could that be? I'm disappointed.",Promonya penipuan atau apa ya? Pas saya cek katanya ada promo 77 ribu dapat kuota 30 GB diskon 40% dari harga awal. Pas saya isi pulsa 80 ribu dan belum registrasi apa-apa malah sudah dipotong 5 ribu. Kok bisa ya? Saya kecewa.,"The promo is deceptive or what? Checked, he said there was a promo of 77 thousand to get a quota of 30 gb 40% discount from the original price, when I filled up the credit of 80 thousand had not been registered, anything had been cut to 5 thousand. Why is that? Disappointed.","Promo itu menipu atau apa? Diperiksa, dia mengatakan ada promo 77 ribu untuk mendapatkan kuota 30 gb diskon 40% dari harga aslinya, ketika saya mengisi pulsa 80 ribu belum terdaftar, ada yang dipotong menjadi 5 ribu. Mengapa demikian? Kecewa.",,2,2,2,2
242,"Katanya detil aroma chamomile, tapi kok baunya tidak enak begini sih",negative,"Aranjeunna nyarios gaduh seungit chamomile, tapi naha éta bau pisan?","Katanya wanginya kamomil, tapi benarkah wanginya seenak itu?","Jarene ambune chamomile, nanging kok mambune ora enak?","Katanya baunya seperti kamomil, tapi mengapa baunya tidak sedap?","They say it has a chamomile scent, but why does it smell so bad?","Katanya wanginya kamomil, tapi kenapa baunya sangat tidak sedap?","He said the smell of chamomile was detailed, but why doesn't it smell so good?","Dia mengatakan bau chamomile sangat detail, tetapi mengapa baunya tidak begitu enak?",2,1,2,1,1
243,Menangkan hadiah keren cukup dengan mengikuti foto kontes baik untuk men di alfamart.,neutral,Kéngingkeun hadiah anu saé ngan ku ngiringan kontes poto pikeun lalaki di Alfamart.,Dapatkan hadiah menarik hanya dengan mengikuti kontes foto khusus pria di Alfamart.,Menang hadiah keren mung melu kontes foto kanggo wong lanang ing Alfamart.,Menangkan hadiah menarik hanya dengan berpartisipasi dalam kontes foto khusus pria di Alfamart.,Win cool prizes just by participating in photo contests for men at Alfamart.,Menangkan hadiah menarik hanya dengan berpartisipasi dalam kontes foto khusus pria di Alfamart.,Win cool prizes simply by taking photos of the contest for men at alfamart.,Menangkan hadiah keren hanya dengan mengambil foto kontes untuk pria di alfamart.,,1,1,1,1
245,"Suasana sawah dan pegunungan, ada wine cellarnya. Tapi makanannya mahal, mestinya kualitas bisa lebih baik karena banyak restoran serupa di bandung sekarang sudah menjamur",negative,"Suasana sawah jeung gunung, aya gudang anggur. Tapi dahareun mahal, kualitasna kudu leuwih alus sabab loba réstoran sarupa di Bandung kiwari keur suung","Suasana sawah dan pegunungan, ada gudang wine. Tapi makanannya mahal, kualitasnya harus lebih baik karena di Bandung sekarang banyak rumah makan sejenis jamur","Swasana sawah lan gunung, ana gudang anggur. Nanging panganane larang, kwalitase kudu luwih apik amarga akeh restoran sing padha ing Bandung saiki padha jamuran","Suasana sawah dan pegunungan, ada gudang wine. Tapi makanannya mahal, kualitasnya harus lebih baik karena sekarang banyak rumah makan yang sama di Bandung yang sudah penuh sesak.","The atmosphere of rice fields and mountains, there is a wine cellar. But the food is expensive, the quality should be better because many similar restaurants in Bandung are now mushrooming","Suasana sawah dan pegunungan, ada gudang wine. Tapi makanannya mahal, kualitasnya harus lebih baik karena sekarang banyak restoran sejenis di Bandung yang menjamur.","The atmosphere of rice fields and mountains, there is a wine cellar. But the food is expensive, the quality should be better because many similar restaurants in Bandung have now mushroomed","Suasana sawah dan pegunungan, ada gudang anggur. Namun makanannya mahal, kualitasnya seharusnya lebih baik karena banyak restoran serupa di Bandung yang kini menjamur",,1,2,2,2
246,Karya bakti bca finance posisi relationship officer membuka lowongan untuk penempatan pekanbaru,neutral,"Jabatan Pengabdian Masyarakat BCA Finance, Relationship Officer, membuka lowongan untuk penempatan di Pekanbaru","Departemen Layanan Masyarakat BCA Finance, Relationship Officer, membuka lowongan untuk penempatan di Pekanbaru","Lowongan Kerja Pengabdian Masyarakat BCA Finance, Relationship Officer, membuka lowongan untuk penempatan di Pekanbaru","Lowongan Kerja Community Service BCA Finance, Relationship Officer, dibuka untuk penempatan di Pekanbaru","BCA Finance's community service position, relationship officer, is opening vacancies for placement in Pekanbaru","Lowongan kerja Community Service Officer BCA Finance, Relationship Officer, untuk penempatan di Pekanbaru",Karya bakti bca finance relationship officer position opens vacancies for Pekanbaru placement,Jabatan Karya bakti bca finance relationship officer membuka lowongan penempatan Pekanbaru,,1,1,1,2
